{
  "id": "REL-01",
  "schema_version": 1,
  "content_version": 1,
  "status": "enabled",
  "name_key": "relic.REL-01.name",
  "summary_key": "relic.REL-01.summary",
  "tags": [],
  "source_refs": [
    "TR-DAT-003"
  ],
  "transformation_key": "relic.REL-01.transformation",
  "tradeoff_key": "relic.REL-01.tradeoff",
  "affected_scope": [
    "all-equipped-weapons"
  ],
  "behavior_kind": "activation-rate-transform-and-opposite-geometry",
  "trigger_condition": "always active while installed",
  "effects": {
    "activation_rate_multiplier": 3,
    "geometry_inverted": true
  },
  "pool_availability": "fresh-profile",
  "overrides_or_replaces": [],
  "sale_value_common_ore": 150,
  "rules": [
    "Only one relic is active at a time."
  ],
  "cross_document_rules": [
    {
      "text": "Directional attacks fire opposite the mech's facing.",
      "parameters": {
        "position_history_minimum_seconds": 2
      }
    }
  ]
}
